<?xml version="1.0" encoding="UTF-8"?>
<xs:schema xmlns:xs="http://www.w3.org/2001/XMLSchema">

<xs:element name="productosfinancieros">
    <xs:complexType>
        <xs:sequence>
            <xs:element ref="producto" minOccurs="1" maxOccurs="unbounded" />
        </xs:sequence>
    </xs:complexType>
</xs:element>
<xs:element name="producto">
    <xs:complexType>
        <xs:choice>
            <xs:element ref="bono" />
            <xs:element ref="acciones" />
        </xs:choice>
    </xs:complexType>
</xs:element>
<xs:element name="bono">
    <xs:complexType>
        <xs:sequence>
            <xs:element ref="valoractual" />
            <xs:element name="beneficio" type="xs:decimal" />
        </xs:sequence>
    </xs:complexType>
</xs:element>
<xs:element name="valoractual">
    <xs:complexType>
        <xs:simpleContent>
            <xs:extension base="xs:decimal">
                <xs:attribute name="moneda" type="tipomoneda" />
            </xs:extension>
        </xs:simpleContent>
    </xs:complexType>
</xs:element>
<xs:simpleType name="tipomoneda">
    <xs:restriction base="xs:string">
        <xs:enumeration value="dolares" />  <xs:enumeration value="euros" />
 <xs:enumeration
            value="yenes" />
    </xs:restriction>
</xs:simpleType>
<xs:element name="acciones">
    <xs:complexType>
        <xs:sequence>
            <xs:element ref="empresa" />
            <xs:element name="beneficio" type="xs:decimal" />
        </xs:sequence>
    </xs:complexType>
</xs:element>
<xs:element name="empresa">
    <xs:complexType>
        <xs:simpleContent>
            <xs:extension base="xs:string">
                <xs:attribute name="pais" type="xs:string" />
            </xs:extension>
        </xs:simpleContent>
    </xs:complexType>
</xs:element>
</xs:schema>