<?xml version="1.0" encoding="UTF-8"?>
<productosfinancieros xmlns:xsi="http://www.w3.org/2001/XMLSchemainstance"
    xsi:noNamespaceSchemaLocation="xsd11.xsd">
    <producto>
        <bono>
            <valoractual moneda="yenes">2.212</valoractual>
            <beneficio>-2.83</beneficio>
        </bono>
    </producto>
    <producto>
        <acciones>
            <empresa pais="usa">ENRON</empresa>
            <beneficio>2.91</beneficio>
        </acciones>
    </producto>
    <producto>
        <bono>
            <valoractual moneda="euros">1.3</valoractual>
            <beneficio>+3.5</beneficio>
        </bono>
    </producto>
</productosfinancieros>